{
  "schemaName": "lcim.invocation",
  "schemaVersion": "1.0.0",
  "invocationId": "lcim_inv_11111111111111111111111111111111",
  "runId": "lcim_run_0123456789abcdef0123456789abcdef",
  "workUnitId": "lcim_wu_0123456789abcdef0123456789abcdef",
  "status": "ASSESSED",
  "provider": "deepseek",
  "model": "deepseek-flash",
  "role": "WORKER",
  "reasoningEffort": "xhigh",
  "startedAt": "2025-01-01T00:00:00.000Z",
  "completedAt": "2025-01-01T00:00:01.000Z",
  "assessedAt": "2025-01-01T00:00:02.000Z",
  "reconciledAt": null,
  "outcome": "SUCCESS",
  "usage": { "inputTokens": 10, "outputTokens": 20, "totalTokens": 30 },
  "assessmentResult": "ACCEPTED",
  "summary": "fixture: successful invocation",
  "evidenceRefs": ["fixture://evidence/1"]
}
